{
  "$schema": "https://json-schema.org/draft/2020-12/schema",
  "$id": "https://northvalley-intelligence.local/schemas/search-eval/captures.schema.json",
  "title": "Search-Eval Captures",
  "description": "What the shopper-facing engine returned per term. Wraps the bare row array the per-store builders used, because a capture with no provenance cannot be re-verified: the verify stage needs to know which path produced a finding in order to re-check it through a different one.",
  "type": "object",
  "additionalProperties": false,
  "required": ["capture_version", "retailer", "captured_at", "engine_profile_ref", "captured_via", "rows"],
  "properties": {
    "capture_version": { "const": "1" },
    "retailer": { "type": "string" },
    "eval_id": { "type": "string" },
    "captured_at": { "type": "string", "format": "date-time" },
    "engine_profile_ref": { "type": "string" },
    "captured_via": {
      "description": "The concrete path used. The verify stage MUST use a different one (L08).",
      "enum": ["storefront_html", "storefront_graphql", "json_api", "browser_dom", "live_ui"]
    },
    "query_pack_ref": { "type": "string" },

    "chunks": {
      "type": "array",
      "description": "L11. Capture proceeds in paced chunks so grading can be pipelined against it and so cumulative rate limits are respected.",
      "items": {
        "type": "object",
        "additionalProperties": false,
        "required": ["chunk_id", "terms", "captured_at"],
        "properties": {
          "chunk_id": { "type": "string" },
          "terms": { "type": "array", "items": { "type": "string" } },
          "captured_at": { "type": "string", "format": "date-time" },
          "blocked": { "type": "boolean" },
          "cooldown_ms": { "type": "integer" }
        }
      }
    },

    "rows": {
      "type": "array",
      "items": {
        "type": "object",
        "additionalProperties": false,
        "required": ["q", "dataset", "total", "zero", "items"],
        "properties": {
          "q": { "type": "string" },
          "dataset": { "type": "string" },
          "total": { "type": "integer", "minimum": 0 },
          "zero": { "type": "boolean" },
          "no_results_msg": {
            "type": "boolean",
            "description": "The engine's own empty-state text. Distinguishes 'none today' from 'failed to load' - without it the two look identical."
          },
          "redirected": { "type": "boolean" },
          "redirect_target": { "type": "string" },
          "items": {
            "type": "array",
            "description": "Organic result titles, in rank order. Carousel and sponsored tiles must be excluded, not merely deprioritized (L09).",
            "items": { "type": "string" }
          },
          "item_skus": { "type": "array", "items": { "type": "string" } },
          "organic_grid_found": {
            "type": ["boolean", "null"],
            "description": "L09. When the organic grid does not render, this is FALSE and items must be empty. Never fall back to carousel tiles."
          },
          "chunk_id": { "type": "string" },
          "source_url": { "type": "string" }
        }
      }
    },

    "recall": {
      "type": "array",
      "description": "Present only for terms whose query-pack entry has_key=true. Emitted here rather than in the board so the raw measurement survives independently of presentation.",
      "items": {
        "type": "object",
        "additionalProperties": false,
        "required": ["q", "key_size", "intersection", "recall"],
        "properties": {
          "q": { "type": "string" },
          "key_size": { "type": "integer" },
          "intersection": { "type": "integer" },
          "recall": { "type": "number", "minimum": 0, "maximum": 1 },
          "extras": { "type": "integer" },
          "missing_skus": { "type": "array", "items": { "type": "string" } },
          "extra_skus": {
            "type": "array",
            "description": "L03-adjacent. Results outside the key that genuinely match are FACET BACKFILL candidates - search telling the catalog what it is missing - not automatically precision errors.",
            "items": { "type": "string" }
          },
          "key_confidence": { "enum": ["high", "medium", "low"] }
        }
      }
    },

    "synonym_candidates": {
      "type": "array",
      "description": "Mined from the vocabulary of key members search MISSED, diffed against those it found. Each arrives with the SKU that proves it and its direction fixed by which side the node name sits on.",
      "items": {
        "type": "object",
        "additionalProperties": false,
        "required": ["from", "to", "direction", "evidence_skus"],
        "properties": {
          "from": { "type": "string" },
          "to": { "type": "string" },
          "direction": { "enum": ["uni", "bi"] },
          "lift": { "type": "number" },
          "evidence_skus": { "type": "array", "minItems": 1, "items": { "type": "string" } },
          "blocked_by_sibling_rule": { "type": "boolean" }
        }
      }
    }
  }
}
